{
  "schemaVersion": "1.0.0",
  "pineVersion": 6,
  "strategyId": "0192f1a0-0000-7000-8000-000000000020",
  "strategyVersionId": "0192f1a0-0000-7000-8000-000000000021",
  "campaignId": "0192f1a0-0000-7000-8000-000000000022",
  "parentVersionId": null,
  "sdlHash": "aaaaaaaaaaaaaaaaaaaaaaaaaaaaaaaaaaaaaaaaaaaaaaaaaaaaaaaaaaaaaaaa",
  "title": "ARF Example Trend Pullback",
  "symbol": "BYBIT:BTCUSDT.P",
  "timeframe": "60",
  "properties": {
    "initialCapital": 10000,
    "currency": "USDT",
    "defaultQtyType": "strategy.percent_of_equity",
    "defaultQtyValue": 10,
    "commissionType": "strategy.commission.percent",
    "commissionValue": 0.06,
    "slippageTicks": 2,
    "pyramiding": 0,
    "marginLongPct": 33.33,
    "marginShortPct": 33.33,
    "processOrdersOnClose": false,
    "calcOnEveryTick": false,
    "calcOnOrderFills": false
  },
  "inputs": [
    {
      "key": "fast_length",
      "type": "int",
      "default": 20,
      "min": 10,
      "max": 50,
      "step": 5
    },
    {
      "key": "slow_length",
      "type": "int",
      "default": 100,
      "min": 60,
      "max": 200,
      "step": 10
    },
    {
      "key": "stop_atr",
      "type": "float",
      "default": 2,
      "min": 1,
      "max": 4,
      "step": 0.25
    },
    {
      "key": "target_r",
      "type": "float",
      "default": 2,
      "min": 1,
      "max": 4,
      "step": 0.25
    }
  ],
  "dateWindow": {
    "startInputKey": "start_date",
    "endInputKey": "end_date"
  },
  "alertSchema": "arf.signal.v1"
}
